{
  "$schema": "https://json-schema.org/draft/2020-12/schema",
  "$id": "https://justanotherdndgame.local/rpg/arena.schema.json",
  "title": "Arene",
  "description": "Une arene de Tanares (LOT-50) : un lieu ou deux camps reglent un litige par leurs champions. Les variantes regionales du Sourcebook -- l'Arene du Futur non letale, Feargus la letale, le duel de baguettes de la Magocratie -- sont des DONNEES, pas des modes : ce qui les distingue tient dans trois champs. Une arene sans carte existe dans le monde sans etre encore un lieu jouable.",
  "allOf": [
    {
      "$ref": "https://justanotherdndgame.local/rpg/common.schema.json#/$defs/entree"
    }
  ],
  "type": "object",
  "properties": {
    "id": true,
    "name": true,
    "source": true,
    "status": true,
    "asset": true,
    "mecanismesRequis": true,
    "narratif": true,
    "region": {
      "type": "string",
      "minLength": 1,
      "description": "Identifiant de la region de l'atlas (LOT-37) ou l'arene se tient."
    },
    "map": {
      "type": "string",
      "pattern": "^[a-z0-9-]+\\.json$",
      "description": "Nom du fichier de carte dans Source/Elements/Levels/. Absent : l'arene n'a pas encore de carte."
    },
    "lethal": {
      "type": "boolean",
      "description": "Vrai si l'on y meurt. Absent vaut faux : c'est la regle des Arenes, et une arene letale est l'exception ecrite ici."
    },
    "heroicMark": {
      "type": "boolean",
      "description": "Vrai si le rituel de Marque Heroique s'y pratique : les combattants sont releves a la fin du combat et disposent de la troisieme economie d'action. Absent vaut vrai."
    },
    "description": {
      "type": "string",
      "minLength": 1
    }
  },
  "required": [
    "id",
    "name",
    "source",
    "region"
  ],
  "additionalProperties": false
}
