{
  "id": "feargus-arena",
  "name": "Feargus Arena",
  "source": "tanares",
  "region": "tsvetan",
  "lethal": true,
  "heroicMark": false,
  "description": "L'arene letale de Feargus, capitale du Tsvetan : sans rituel, sans rappel. Pas encore de carte : elle existe dans le monde, pas encore comme lieu jouable."
}
