{
  "id": "magic-duel-arena",
  "name": "Magic Duel Arena",
  "source": "tanares",
  "region": "magocracy-of-mage-tower",
  "lethal": false,
  "heroicMark": false,
  "description": "Le duel de baguettes de la Magocratie : une arene ovale ceinte de barrieres magiques, ou l'on ne combat qu'avec les sept baguettes remises avant l'affrontement. Pas encore de carte."
}
